{
  "schema_version": "2.0",
  "plan_id": "fixture-spike",
  "title": "Spike posture fixture",
  "status": "complete",
  "stage": "complete",
  "work_shape": "map",
  "mode": "map",
  "gates": {
    "intent": {"status": "approved"},
    "design": {"status": "not_required"},
    "architecture_sync": {"status": "not_required"}
  },
  "engineering_posture": {
    "schema_version": "2.1",
    "kind": "spike",
    "source": {"kind": "explicit_assessment", "ref": "fixtures/spike"},
    "objective": "Answer one bounded technical question with disposable implementation.",
    "required_evidence": ["question_answered", "result_validity"],
    "allowed_capabilities": ["answer-question"],
    "excluded_capabilities": ["deployment-automation"],
    "safety_floor": ["bound_runaway_resource_cost", "fail_loud_on_invalid_results", "prevent_credential_exposure", "prevent_destructive_data_loss"],
    "promotion_policy": "Promotion requires explicit user approval and re-enters design and architecture synchronization.",
    "posture_hash": "32162fab4333060126d12350d746c2f135a816eaf6e7e7636d17e2d0c14375f9"
  },
  "posture_evidence": ["question_answered", "result_validity"],
  "architecture_snapshot": null,
  "design_refs": [],
  "artifacts": [],
  "current_node": null,
  "nodes": [{
    "id": "N-001",
    "title": "Answer the bounded question",
    "status": "done",
    "depends_on": [],
    "inputs": ["question"],
    "outputs": ["answer evidence"],
    "acceptance": ["answer validity is recorded"],
    "blocking_questions": [],
    "posture_ref": {"kind": "spike", "posture_hash": "32162fab4333060126d12350d746c2f135a816eaf6e7e7636d17e2d0c14375f9", "source_ref": "fixtures/spike"},
    "scope_provenance": [{"kind": "requirement", "ref": "R-QUESTION", "behavior_id": "answer"}],
    "behavior_budget": {"required": ["answer"], "excluded": ["deploy"], "deferred_candidates": ["general-api"]},
    "deferred_candidates": []
  }]
}
