{
  "schema_version": "2.0",
  "plan_id": "fixture-experiment",
  "title": "Experiment posture fixture",
  "status": "complete",
  "stage": "complete",
  "work_shape": "map",
  "mode": "map",
  "gates": {
    "intent": {"status": "approved"},
    "design": {"status": "not_required"},
    "architecture_sync": {"status": "not_required"}
  },
  "engineering_posture": {
    "schema_version": "2.1",
    "kind": "experiment",
    "source": {"kind": "explicit_assessment", "ref": "fixtures/experiment"},
    "objective": "Evaluate a stated hypothesis with valid and reproducible measurements.",
    "required_evidence": ["hypothesis", "measurement_validity", "reproduction_instructions"],
    "allowed_capabilities": ["measurement"],
    "excluded_capabilities": ["deployment-automation"],
    "safety_floor": ["bound_runaway_resource_cost", "fail_loud_on_invalid_results", "prevent_credential_exposure", "prevent_destructive_data_loss"],
    "promotion_policy": "Promotion requires explicit user approval and re-enters design and architecture synchronization.",
    "posture_hash": "c57c77cf00d21ec0c6da9fd3dec7f33e609dd02e9fbd885610f3a10dd1280e94"
  },
  "posture_evidence": ["hypothesis", "measurement_validity", "reproduction_instructions"],
  "architecture_snapshot": null,
  "design_refs": [],
  "artifacts": [],
  "current_node": null,
  "nodes": [{
    "id": "N-001",
    "title": "Measure the hypothesis",
    "status": "done",
    "depends_on": [],
    "inputs": ["hypothesis"],
    "outputs": ["reproducible measurement"],
    "acceptance": ["measurement validity is recorded"],
    "blocking_questions": [],
    "posture_ref": {"kind": "experiment", "posture_hash": "c57c77cf00d21ec0c6da9fd3dec7f33e609dd02e9fbd885610f3a10dd1280e94", "source_ref": "fixtures/experiment"},
    "scope_provenance": [{"kind": "requirement", "ref": "R-HYPOTHESIS", "behavior_id": "measure"}],
    "behavior_budget": {"required": ["measure"], "excluded": ["deploy"], "deferred_candidates": ["dashboard"]},
    "deferred_candidates": []
  }]
}
