{
  "schema_version": "2.0",
  "plan_id": "fixture-reusable-internal",
  "title": "Reusable internal posture fixture",
  "status": "complete",
  "stage": "complete",
  "work_shape": "map",
  "mode": "map",
  "gates": {
    "intent": {"status": "approved"},
    "design": {"status": "not_required"},
    "architecture_sync": {"status": "not_required"}
  },
  "engineering_posture": {
    "schema_version": "2.1",
    "kind": "reusable_internal",
    "source": {"kind": "explicit_assessment", "ref": "fixtures/reusable_internal"},
    "objective": "Provide a stable local contract for repeated use inside the project.",
    "required_evidence": ["compatibility_evidence", "integration_tests", "stable_local_contract"],
    "allowed_capabilities": ["local-contract"],
    "excluded_capabilities": ["deployment-automation"],
    "safety_floor": ["bound_runaway_resource_cost", "fail_loud_on_invalid_results", "prevent_credential_exposure", "prevent_destructive_data_loss"],
    "promotion_policy": "Promotion requires explicit user approval and re-enters design and architecture synchronization.",
    "posture_hash": "cf17270575b6e6285b49efe0a6bb486c5687b549ed2baf209867a08e77a414d2"
  },
  "posture_evidence": ["compatibility_evidence", "integration_tests", "stable_local_contract"],
  "architecture_snapshot": null,
  "design_refs": [],
  "artifacts": [],
  "current_node": null,
  "nodes": [{
    "id": "N-001",
    "title": "Provide the local contract",
    "status": "done",
    "depends_on": [],
    "inputs": ["approved local interface"],
    "outputs": ["tested local contract"],
    "acceptance": ["local integration passes"],
    "blocking_questions": [],
    "posture_ref": {"kind": "reusable_internal", "posture_hash": "cf17270575b6e6285b49efe0a6bb486c5687b549ed2baf209867a08e77a414d2", "source_ref": "fixtures/reusable_internal"},
    "scope_provenance": [{"kind": "requirement", "ref": "R-LOCAL", "behavior_id": "local-contract"}],
    "behavior_budget": {"required": ["local-contract"], "excluded": ["deploy"], "deferred_candidates": ["public-api"]},
    "deferred_candidates": []
  }]
}
